thai_scale,pitches,jazz_equivalent,compatible_chords,application
Lai Yai (ลายใหญ่),"A, C, D, E, G",A minor pentatonic,"Am7, Dm7, Em7(b5), Fmaj7, G7sus4","Modal jazz, bass improvisation"
Lai Noi (ลายน้อย),"D, F, G, A, C",D minor pentatonic,"Dm7, Gm7, Am7(b5), Bbmaj7, C7sus4","Reharmonization, Dorian mode"
Lai Se (ลายเส),"E, G, A, B, D",E minor pentatonic,"Em7, Am7, Bm7(b5), Cmaj7, D7sus4",Khaen improvisation style
Lai Sutsanaen (ลายสุดสะแนน),"C, D, E, G, A",C major pentatonic,"Cmaj7, Dm7, Em7, Am7, G7sus4","Major tonality, bright sound"
Nora Scale,"C, D, E, G (with G as marker)",C major pentatonic subset,"Cmaj7, G7sus4, Am7",Southern Thai melodic style
